{
  "schema_version": 1,
  "feedback_record_id": "01JZFDBK0000000000000001",
  "workspace_id": "01JZWORKSPACE0000000000001",
  "target_type": "writing_run",
  "target_id": "01JZWRITING00000000000001",
  "feedback_type": "quality",
  "score": 0.82,
  "source": "quality_gate",
  "comment_ref": "object://quality-comments/01JZFDBK0000000000000001",
  "payload": {
    "quality_report_id": "01JZQLTREP000000000000001",
    "summary": "质量门禁通过后保留了节奏与可读性指标。"
  },
  "created_at": "2026-07-11T03:10:00Z",
  "updated_at": "2026-07-11T03:10:00Z"
}
